{
  "schema_version": 1,
  "record_id": "b45e481fd25a4df4b936ba4152df93e1",
  "task_id": "bto-single-domain",
  "project": "eels-script",
  "site": "arrhenius",
  "authoring_tool": "codex",
  "code_revision": "a5b65a3024a5a0ad8a8633020ec21b8f4fa5c452",
  "created_at": "2026-10-21T20:38:55.260976+00:00",
  "status": "verified",
  "scope": "Local validation of this record/code snapshot; portable Slurm template not submitted, and original cluster smoke-test scope remains unchanged.",
  "claim": "The preserved experiment and knowledge update pass 15 workflow contracts, six BTO regression tests, shell syntax, metadata/context/link checks and source-hash/sanitization checks.",
  "evidence": [
    "research-workflow/docs/bto-single-domain-record-validation-2026-10-21.json",
    "research-workflow/docs/bto-single-domain-arrhenius-2026-10-21.json"
  ],
  "criterion": "Both suites exit zero, local checks pass, source fingerprints match the evidence manifest, and all execution/promotion gates remain disabled.",
  "next_action": "Commit the reviewed small source and records, prepare a local handover, and fast-forward the primary checkout if still clean."
}
