{
  "schema_version": 1,
  "record_id": "89ad0a8121a84cfaa9755a3c4a3b3ab4",
  "task_id": "bto-single-domain",
  "project": "eels-script",
  "site": "arrhenius",
  "authoring_tool": "codex",
  "code_revision": "80107a4d869164d0bad49c7c96cbfec51724d822",
  "created_at": "2026-10-21T20:39:54.357057+00:00",
  "status": "verified",
  "scope": "Local primary-checkout integration and regression checks only; no remote publication, new cluster job, portable-template submission or production activation.",
  "claim": "The primary EELS_script main checkout was fast-forwarded to local commit 80107a4, and all 15 workflow contracts plus six BTO regressions passed again on that integrated source; experiment fingerprints and Arrhenius context were checked there.",
  "evidence": [
    "git:80107a4",
    "research-workflow/docs/bto-single-domain-record-validation-2026-10-21.json"
  ],
  "criterion": "Primary checkout is clean; both test suites exit zero on integrated code; source hashes match the evidence manifest; context loads two Arrhenius lessons with execution disabled and no active release.",
  "next_action": "Review the preserved BTO experiment and explicitly authorize exact inputs/resources before any longer production run; verify long-time domain order and spectral convergence afterward."
}
