{
  "schema_version": 1,
  "record_id": "89d3aa568cc2488eb7edb790bfab71db",
  "task_id": "bto-duration-50ps",
  "project": "eels-script",
  "site": "arrhenius",
  "authoring_tool": "codex",
  "code_revision": "d6002c07ddebae76b67144221c455ea6a6152cbd",
  "created_at": "2026-10-21T20:54:00.158953+00:00",
  "status": "verified",
  "scope": "Local configuration/export validation only; no job submitted.",
  "claim": "Both BTO workflows now default to 50 ps total: 10 ps equilibration plus 40 ps production; integration remains 1 fs and saved production interval 5 fs. Both Slurm templates allow 60 hours.",
  "evidence": [
    "research-workflow/docs/bto-duration-50ps-2026-10-21.json"
  ],
  "criterion": "Both input/runner copies agree, total steps are 50000 and production frame count 8001, 21 regressions pass, final synthetic ASE time is 40 ps, Slurm shell syntax passes and original evidence hashes are unchanged.",
  "next_action": "Commit and integrate the confirmed duration update; review the 60-hour resource plan before an explicitly authorized production submission."
}
